"text", "translation"
"実は、同級生から月に3回以上は\n『お姉ちゃん』と呼び間違えられる。","As a matter of fact, my classmates mistakenly call me 'big sister' at least three times a month."
"実は、右クリックの時だけ\n体が右に傾くクセがある。","In fact, I have a habit of leaning to the right only when I right-click."
"実は、童話の語り聞かせが得意。","In fact, she is good at telling fairy tales."
"実は、手書きPOPの腕がプロ級。","In fact, she is a pro at handwriting POP."
"実は、音ゲー専用のプレイヤー名がある。","In fact, there is a player name dedicated to sound games."
"実は、お手玉なら永遠に続けられる。","In fact, you can go on forever with a magic ball."
"実は、授業中に悪い奴が現れた時の対処法を\n10パターン以上考えている。","In fact, I have more than ten patterns of what to do when a bad guy shows up in class."
"実は、古代遺跡に詳しい。","Actually, I'm familiar with ancient ruins."
"実は、激辛派。","Actually, I'm a very spicy person."
"実は、自作の少女漫画ノートが\n引き出しの奥深くに眠っている。","In fact, I have my own shoujo manga notebooks lying deep in a drawer."
"実は、咥えている枝は自家栽培。","In fact, the branch I'm sucking on is homegrown."
"実は、ノートを使い切るのがやたら早い。","In fact, I'm running out of notebooks very quickly."
"実は、ファースリッパのふわふわ度を\n内心レビューする癖がある。","In fact, I have a habit of inwardly reviewing the fluffiness of fur slippers."
"実は、風呂上がりはフルーツ牛乳派。","Actually, I'm a fruit milk drinker after taking a bath."
"実は、好きな映画のベスト10のうち\n半分がホラー。","In fact, half of my top ten favorite movies are horror."
"実は、1年で12㎝も背が伸びたことがある。","In fact, I've grown 12 cm taller in a year."
"実は、天気が悪いと\nちょっとだけ声が小さくなる。","In fact, my voice gets a little shrill when the weather is bad."
"実は、ルームメイトが\nいない時は寝つけない。","Actually, I can't sleep when my roommate is not around."
"実は、パパの言うことだけは\n絶対に聞かない。","In fact, I never just listen to my dad."
"実は、牛に好かれやすい。","In fact, cows like me easily."
"実は、いつか自分のネイルブランドを\n立ち上げる野望がある。","In fact, I have ambitions to start my own nail brand someday."
"実は、炭酸飲料が飲めない。","Actually, I can't drink carbonated drinks."
"実は、学園一綺麗に前転ができる。","In fact, I can do the cleanest forward roll in the school."
"実は、エレベーターがちょっと苦手。","To tell you the truth, I'm not a big fan of elevators."
"実は、今の帽子は3代目。","In fact, my current hat is the third generation."
"実は、三つ編みの数は正確に決まっている。","In fact, there is an exact number of braids."
"実は、教わったパリピ語を\nすべて日記に残している。","In fact, I have kept a diary of all the Parisian words I was taught."
"実は、とりまメンブレの時は\nズッ友にかまちょ、と思っている。","In fact, I'm thinking of asking Zutto for help when I'm in a membrance."
"実は、ムーンウォークが得意。","In fact, she is good at moonwalking."
"実は、お父さまからもらった\nジュークボックスが宝物。","In fact, she treasures the jukebox that his father gave him."
"実は、好きなものはたいていひと目惚れ。","In fact, what I like is usually love at first sight."
"実は、赤い車が通るとつい見てしまう。","In fact, I can't help but look when a red car passes by."
"実は、カラフルな大特価チラシを\n見るのが好き。","Actually, I like to look at the colorful big discount flyers."
"実は、動揺すると\n幼児のような字しか書けなくなる。","In fact, when I get upset, I can only write like a toddler."
